id  | recipe_id | step|  detail_en                                                                                                           | detail_fr
114 | 21        | 1   | Preheat the oven at 200 °C. Mix the tomato sauce with the spices. Add salt and pepper                                | Préchauffer le four à 200°C (thermostat 6-7). Mélanger le coulis de tomate avec le 4 épices, saler et poivrer si besoin
115 | 21        | 2   | Slice the mozzarella                                                                                                 | Egoutter la mozzarella et la couper en tranches
116 | 21        | 3   | Cut the pizza dough and place it on the pan. Pour tomato sauce and add mozzarella                                    | Dérouler la pâte à pizza et la placer sur une plaque allant au four en conservant le papier cuisson dessous. Badigeonner de coulis de tomate et répartir les tranches de mozzarella
117 | 21        | 4   | In the oven for 15 minutes                                                                                           | Enfourner 15 minutes
118 | 21        | 5   | Add pepperoni and basil                                                                                              | Ajouter les tranches de pepperoni et les feuilles de basilic
119 | 21        | 6   | Back in the oven for 5 more minutes                                                                                  | Enfourner à nouveau 5 minutes
120 | 22        | 1   | Chop onions and garlic. Color them in a pan with butter                                                              | Hacher l'oignon et l'ail. Les faire revenir dans le beurre jusqu'à ce qu'ils soient tendres
121 | 22        | 2   | Add the tomatoes (concassee), minced meat, flour, salt, pepper and herbes de provence                                | Ajouter les tomates coupées en dés, la viande hachée, la farine, du sel, du poivre et les herbes de Provence
122 | 22        | 3   | When everything is cooked, add the egg yold and a bit of parmesan. Stir properly                                     | Quand tout est cuit, couper le feu et ajouter le jaune d'oeuf et un peu de parmesan. Bien mélanger
123 | 22        | 4   | Prepare the mashed potatoes. Put it on top of the meat. In the oven at 200 °C                                        | Préchauffer le four à 200°C (thermostat 6-7). Etaler au fond du plat à gratin. Préparer la purée. L'étaler au dessus de la viande. Saupoudrer de fromage râpé et faire gratiner
124 | 23        | 1   | Chop the sage, basil and parsley                                                                                     | Hachez la sauge, le basilic et le persil
125 | 23        | 2   | Chop the onions. Dice the celery                                                                                     | Hachez les oignons, découpez le céleri en cubes
126 | 23        | 3   | Dice the mushrooms                                                                                                   | Détaillez les champignons en cubes également
127 | 23        | 4   | Cook the onions, celery and mushrooms in olive oil                                                                   | Faites chauffer 3 cuillerées à soupe d'huile d'olive dans une cocotte, mettez-y les oignons, le céleri et les champignons
128 | 23        | 5   | Add the garlic, tomato paste and minced meat                                                                         | Ajoutez l'ail écrasé, le concentré de tomate, la sauce tomate, la viande hachée et pressez bien le tout
129 | 23        | 6   | Add the thyme and bayleaf. Pour 50 cl of water. Add the herbs, 2 sugar cubes, harissa, salt and pepper               | Ajoutez alors le thym et le laurier, mouillez de 50 cl d'eau, rajoutez les herbes fraîches hachées, 2 morceaux de sucre, la harissa, assaisonner
130 | 23        | 7   | Let simmer for 30 minutes                                                                                            | Laissez mijoter 30 min à feu doux
131 | 23        | 8   | 10 minutes before the end, cook the pasta                                                                            | 10 minutes avant la fin, faites cuire les pâtes al dente
132 | 23        | 9   | Take the bayleaf off the sauce. Add the pasta                                                                        | Retirez le laurier de la sauce, versez-la sur les pâtes
133 | 23        | 10  | Add parmesan and serve                                                                                               | Parsemez de parmesan et servez
134 | 24        | 1   | Cook the pasta                                                                                                       | Portez à ébullition un faitout d'eau salée. Plongez-y les spaghetti et laissez-les cuire environ 12 min, jusqu'à ce qu'ils soient al dente
135 | 24        | 2   | While the pasta are cooking, cook the lardons                                                                        | Pendant la cuisson des spaghetti, faites revenir les lardons à sec dans une poêle, jusqu'à ce qu'ils soient bien dorés
136 | 24        | 3   | Add the cream. Add salt and pepper. Add the yolks                                                                    | Baissez le feu et incorporez la crème fraîche. Salez légèrement, poivrez généreusement et ajoutez les jaunes d'oeufs, en fouettant pour qu'ils ne cuisent pas
137 | 24        | 4   | Add the pasta to the sauce                                                                                           | Egouttez les pâtes. Versez-les dans la sauteuse, mélangez et transvasez dans un plat de service
138 | 24        | 5   | Add parmesan and serve                                                                                               | Servez en présentant le parmesan à part
139 | 25        | 1   | Cook the pasta                                                                                                       | Cuire les pâtes à l'eau bouillante salée selon le temps indiqué sur le paquet
140 | 25        | 2   | While the pasta are cooking, melt the butter in a pan and addd the cream                                             | Pendant ce temps, faire fondre le beurre dans une casserole et y ajouter la crème
141 | 25        | 3   | When the cream is warm, add the diced salmon                                                                         | Quand la crème est bien chaude, y plonger les dés de saumon, ils doivent cuire à la chaleur de la crème
142 | 25        | 4   | When the salmon is cooked, add salt, pepper and nutmeg                                                               | Quand ils sont cuits (ils doivent se détacher), ajouter le sel, le poivre et la muscade moulue
143 | 25        | 5   | Add the pasta to the sauce                                                                                           | Ajouter les pâtes à la sauce
144 | 25        | 6   | Add parmesan and serve                                                                                               | Ajouter du parmesan et servez
145 | 26        | 1   | Peel and dice the potatoes                                                                                           | Eplucher les pommes de terre, les couper en dés, bien les rincer et les essuyer dans un torchon propre
146 | 26        | 2   | Cook the onions in a pan with oil                                                                                    | Faire chauffer l'huile dans une poêle, y faire fondre les oignons
147 | 26        | 3   | Add the potatoes and color them                                                                                      | Lorsque les oignons sont fondus, ajouter les pommes de terre et les faire dorer de tous les côtés
148 | 26        | 4   | Add the lardons                                                                                                      | Lorsqu'elles sont dorées, ajouter les lardons et finir de cuire
149 | 26        | 5   | Cut the cheese                                                                                                       | D'autre part, gratter la croûte du reblochon et le couper en deux (ou en quatre)
150 | 26        | 6   | Preheat the oven at 200 °C                                                                                           | Préchauffer le four à 200°C (thermostat 6-7) et préparer un plat à gratin en frottant le fond et les bords avec la gousse d'ail épluchée
151 | 26        | 7   | Build the tartiflette (cheese on top of everything)                                                                  | Dans le plat à gratin, étaler une couche de pommes de terre aux lardons, disposer dessus la moitié du reblochon, puis de nouveau des pommes de terre. Terminer avec le reste du reblochon (croûte vers les pommes de terre)
152 | 26        | 8   | In the oven for 20 minutes                                                                                           | Enfourner pour environ 20 minutes de cuisson
153 | 27        | 1   | Melt the butter in a pan                                                                                             | Faites fondre le beurre dans une casserole à fond épais
154 | 27        | 2   | Add the flour                                                                                                        | Ajoutez la farine et remuez avec une cuillère de bois sans laisser colorer. La farine doit juste épaissir
155 | 27        | 3   | Add the milk little by little and keep stiring                                                                       | Versez le lait progressivement, sans cesser de remuer, jusqu'à ce que la sauce épaississe
156 | 27        | 4   | Add salt, pepper and nutmeg                                                                                          | Assaisonnez de sel, poivre et muscade râpée
157 | 28        | 1   | Get the juice from the lemon. Dice the butter                                                                        | Pressez le jus du citron, réservez. Coupez le beurre en dés
158 | 28        | 2   | Dilute the yolk with some water                                                                                      | Battez les jaunes d'oeufs avec 2 cuillerées à soupe d'eau froide
159 | 28        | 3   | Place in a bain-marie and whisk until you have a nice sauce                                                          | Placez dans un bain-marie chaud et fouettez jusqu'à l'obtention d'une crème mousseuse et légère
160 | 28        | 4   | Add the melted butter                                                                                                | Ajoutez alors le beurre en morceaux en plusieurs fois, en fouettant bien à chaque fois
161 | 28        | 5   | Add salt, pepper and add lemon juice before serving                                                                  | Salez, poivrez et incorporez le jus du citron avant de servir
162 | 29        | 1   | Mix the egg yolk, salt, pepper, mustard and vinegar                                                                  | Les ingrédients doivent être à température ambiante. Mélangez le jaune d'oeuf, un peu de sel, poivre, la moutarde et le vinaigre
163 | 29        | 2   | Whisk with oil until wanted consistency                                                                              | Fouetter en versant peu à peu l'huile, la mayonnaise doit peu à peu épaissir
164 | 29        | 3   | You can add herbs or lemon for flavor                                                                                | On peut y ajouter des herbes ou du citron pour la parfumer
165 | 30        | 1   | Prepare the tomato sauce                                                                                             | Préparer la sauce tomate
166 | 31        | 1   | Wash, peel and cut the potatoes                                                                                      | Peler les pommes de terre et les laver, puis les détailler en parallélépipèdes à base carrée d’environ 1,5 cm de côté (en d’autres termes, en grosses frites). Les laver à nouveau et bien les sécher dans un torchon à vaisselle propre
167 | 31        | 2   | Deep fry them a first time at 150 °C                                                                                 | Les faire cuire une première fois dans l’huile chauffée à 150°C, pendant 7 à 8 minutes. Il ne faut pas surcharger la friteuse: pour 1 kg de pommes de terre, cuire 1/3 des frites à la fois
168 | 31        | 3   | Deep fry them a second time at 190 °C                                                                                | Cuire les frites une seconde fois dans l’huile chauffée à 190°C pendant environ 3 mn (elles doivent être croustillantes sans être dures)
169 | 32        | 1   | Wash, peel and cut the potatoes                                                                                      | Eplucher et laver les pommes de terre, puis les couper en tranches de 1,5 cm d'épaisseur, puis en cubes. Ne plus les laver
170 | 32        | 2   | Color the potatoes in a pan with oil                                                                                 | Dans une sauteuse, faire chauffer 3 cuillères à soupe d'huile. Lorsque l'huile est chaude, y mettre les pommes de terre d'un coup, puis les enrober d'huile dans tous les sens avec une cuillère en bois
171 | 32        | 3   | Add salt, pepper and curry                                                                                           | Ajouter sel et poivre (et éventuellement curry), puis re-mélanger
172 | 32        | 4   | Cook the potatoes                                                                                                    | Porter à feu maximal et faire cuire avec le couvercle jusqu'à ce qu'une bonne odeur de pommes de terre grillées s'échappe... Ne pas les découvrir avant! Cela prend entre 3 et 5 minutes
173 | 33        | 1   | Peel and cut the potatoes                                                                                            | Epluchez et coupez les pommes de terre en morceaux
174 | 33        | 2   | Cook the potatoes in water                                                                                           | Mettez-les à cuire dans un grand volume d'eau salée jusqu'à ce que la pointe d'un couteau rentre facilement dans la chair
175 | 33        | 3   | Mash the potatoes                                                                                                    | Passez-les alors au moulin à légumes
176 | 33        | 4   | Add the milk, cream and nutmeg                                                                                       | Ajoutez le lait pour délayez jusqu'à la consistance souhaitée, la crème fraîche pour l'onctuosité et un peu de muscade râpée
177 | 34        | 1   | Wash and peel the potatoes                                                                                           | Eplucher et laver les pommes de terre
178 | 34        | 2   | Cook the potatoes in water                                                                                           | Cuire les pommes de terre à l'eau, ou à la vapeur, jusqu'à ce qu'elles soient bien tendre
179 | 34        | 3   | Preheat the oven at 200 °C. Mash the potatoes                                                                        | Préchauffer le four à 200°C (thermostat 6/7). Écraser les pommes de terre à la fourchette ou les passer au moulin à légumes
180 | 34        | 4   | Mix the potatoes with butter and egg yolk. Add salt and pepper                                                       | Mélanger la purée ainsi obtenue avec le beurre et les jaunes d'oeufs. Saler et poivrer
181 | 34        | 5   | Place the mixture in a piping bag. Drop it on a pan                                                                  | Placer la préparation dans une poche à douille et déposer des noix de préparation sur une plaque recouverte de papier cuisson. Si vous n'avez pas de poche à douille, utiliser une cuillère
182 | 34        | 6   | In the oven for 10 minutes (the pommes duchees must be golden)                                                       | Enfourner 10 minutes. Les pommes duchesse doivent être dorées
